{
  "task_id": "BD-T02",
  "commit": "68a96bd852494b0aed212e318ac1e05a72983d30",
  "branch": "main",
  "config_hash": "",
  "policy_versions": {},
  "command": [
    "python",
    "-c",
    "\nfrom beidou_shared.config import ConfigProvider\n# Verify SAFETY_ONLY fallback\ns1 = ConfigProvider().load(environment='UNKNOWN_MODE')\nassert s1.environment.value == 'safety_only', f'Expected safety_only, got {s1.environment}'\nassert not s1.can_write_trades, 'Expected can_write_trades=False for unknown env'\n# Verify Paper mode\ns2 = ConfigProvider().load(environment='paper')\nassert s2.environment.value == 'paper', f'Expected paper, got {s2.environment}'\nassert not s2.can_write_trades, 'Expected can_write_trades=False for paper'\n# Verify config hash stable\nh1 = s1.config_hash\nh2 = ConfigProvider().load(environment='UNKNOWN_MODE').config_hash\nassert h1 == h2, 'Config hash not stable'\nprint('BD-T02 CONFIG VERIFICATION PASSED')\n"
  ],
  "exit_code": 0,
  "started_at": "2026-08-08T15:54:02.801834+00:00",
  "finished_at": "2026-08-08T15:54:02.841002+00:00",
  "stdout_path": "artifacts/evidence/BD-T02/20260808T155402801698Z.stdout.log",
  "stderr_path": "artifacts/evidence/BD-T02/20260808T155402801698Z.stderr.log",
  "stdout_sha256": "d57b65da23e4923737d31b088185a04aff4f9f6eadb91587d981393ecb1a5fa7",
  "stderr_sha256": "e3b0c44298fc1c149afbf4c8996fb92427ae41e4649b934ca495991b7852b855",
  "artifact_hashes": {},
  "agent_id": "unknown-agent",
  "status": "PASS"
}
