{
  "task_id": "BD-T02",
  "commit": "68a96bd852494b0aed212e318ac1e05a72983d30",
  "branch": "main",
  "config_hash": "",
  "policy_versions": {},
  "command": [
    "python",
    "-c",
    "from beidou_shared.config import ConfigProvider; s=ConfigProvider().load(environment='UNKNOWN_MODE'); assert not s.can_write_trades; print('PASS: SAFETY_ONLY fallback')"
  ],
  "exit_code": 0,
  "started_at": "2026-08-08T15:54:10.895014+00:00",
  "finished_at": "2026-08-08T15:54:10.928101+00:00",
  "stdout_path": "artifacts/evidence/BD-T02/20260808T155410894882Z.stdout.log",
  "stderr_path": "artifacts/evidence/BD-T02/20260808T155410894882Z.stderr.log",
  "stdout_sha256": "4ff6f9b553503e55126274018fd1514453eeb42cb967b9e00c7620246c3d13e1",
  "stderr_sha256": "e3b0c44298fc1c149afbf4c8996fb92427ae41e4649b934ca495991b7852b855",
  "artifact_hashes": {},
  "agent_id": "unknown-agent",
  "status": "PASS"
}
