{
  "task_id": "BD-T00",
  "commit": "73e11b2f2067381fd77e18209a64d65ecefb9b1b",
  "branch": "main",
  "config_hash": "",
  "policy_versions": {},
  "command": [
    "python",
    "-m",
    "compileall",
    "-q",
    "beidou_autonomy",
    "beidou_bootstrap",
    "beidou_certification",
    "beidou_chaos",
    "beidou_control",
    "beidou_core",
    "beidou_data",
    "beidou_delivery",
    "beidou_exchange",
    "beidou_infra",
    "beidou_launcher",
    "beidou_lifecycle",
    "beidou_observability",
    "beidou_policy",
    "beidou_production",
    "beidou_reporting",
    "beidou_research",
    "beidou_safety",
    "beidou_security",
    "beidou_shared",
    "beidou_state.db",
    "beidou_state.db-shm",
    "beidou_state.db-wal",
    "beidou_strategy",
    "apps"
  ],
  "exit_code": 0,
  "started_at": "2026-08-08T15:48:57.420060+00:00",
  "finished_at": "2026-08-08T15:48:57.459086+00:00",
  "stdout_path": "artifacts/evidence/BD-T00/20260808T154857419912Z.stdout.log",
  "stderr_path": "artifacts/evidence/BD-T00/20260808T154857419912Z.stderr.log",
  "stdout_sha256": "e3b0c44298fc1c149afbf4c8996fb92427ae41e4649b934ca495991b7852b855",
  "stderr_sha256": "e3b0c44298fc1c149afbf4c8996fb92427ae41e4649b934ca495991b7852b855",
  "artifact_hashes": {},
  "agent_id": "unknown-agent",
  "status": "PASS"
}
